{
    "id": "balance_quartet_veteran",
    "label": "Balance Quartet (Veteran L90)",
    "notes": "docs/24 I4 / docs/22 A4 — late tier of the four-vocation ladder. Same roles as balance_quartet; L90 unlocks front_sweep / fierce_rampage / strong_* spears & strikes. Pair with standard_arena_waves for progression A/B.",
    "members": [
        {
            "profileId": "guardian_veteran",
            "name": "Guardian",
            "isLeader": true
        },
        {
            "profileId": "scout_veteran",
            "name": "Scout",
            "isLeader": false
        },
        {
            "profileId": "adept_veteran",
            "name": "Adept",
            "isLeader": false
        },
        {
            "profileId": "warden_veteran",
            "name": "Warden",
            "isLeader": false
        }
    ]
}
